{
  "$schema": "http://json-schema.org/draft-07/schema#",
  "$id": "module.schema.json",
  "title": "Jump Start Module Manifest",
  "description": "Schema for validating Jump Start add-on module manifests.",
  "type": "object",
  "required": ["name", "version", "description"],
  "properties": {
    "name": {
      "type": "string",
      "pattern": "^[a-z][a-z0-9-]*$",
      "description": "Module name (lowercase, kebab-case)."
    },
    "version": {
      "type": "string",
      "pattern": "^\\d+\\.\\d+\\.\\d+",
      "description": "Semantic version string."
    },
    "description": {
      "type": "string",
      "minLength": 10,
      "description": "Human-readable description of the module's purpose."
    },
    "author": {
      "type": "string",
      "description": "Module author name or organization."
    },
    "license": {
      "type": "string",
      "description": "SPDX license identifier."
    },
    "homepage": {
      "type": "string",
      "format": "uri",
      "description": "URL to the module's homepage or repository."
    },
    "engines": {
      "type": "object",
      "properties": {
        "jumpstart": {
          "type": "string",
          "description": "Required Jump Start framework version range."
        }
      }
    },
    "agents": {
      "type": "array",
      "items": { "type": "string" },
      "description": "Relative paths to agent persona files this module provides."
    },
    "templates": {
      "type": "array",
      "items": { "type": "string" },
      "description": "Relative paths to template files this module provides."
    },
    "commands": {
      "type": "array",
      "items": { "type": "string" },
      "description": "Relative paths to command definition files this module provides."
    },
    "checks": {
      "type": "array",
      "items": { "type": "string" },
      "description": "Relative paths to quality check scripts this module provides."
    },
    "skills": {
      "type": "array",
      "items": { "type": "string" },
      "description": "Relative paths to skill directories this module provides."
    },
    "dependencies": {
      "type": "array",
      "items": { "type": "string" },
      "description": "Other Jump Start modules this module depends on."
    },
    "keywords": {
      "type": "array",
      "items": { "type": "string" },
      "description": "Discovery keywords for marketplace search."
    }
  },
  "additionalProperties": false
}
